{
  "$schema": "../schema/claim-ledger.schema.json",
  "schema_version": "0.1.0",
  "ledger_id": "CLAIMLEDGER-ADOS-GLOSSARY-EVOLUTION",
  "source_set_id": "SOURCESET-ADOS-GLOSSARY-EVOLUTION",
  "claims": [
    {
      "claim_id": "CLM-V13-001",
      "source_id": "SRC-V1.3-RESULT",
      "exact_quote": "Use `schemas/*.schema.json` and `data/*.json` as the primary JSON Schema validation layer.",
      "normalized_claim": "v1.3 uses schemas and machine records as its primary validation layer.",
      "claim_type": "method",
      "dependency_on_other_claims": [],
      "evidence_refs": [
        "EVD-V13-001"
      ],
      "weight_dimensions": {
        "goal_impact": 5,
        "decision_leverage": 5,
        "dependency_centrality": 5,
        "scope_breadth": 4,
        "verification_burden": 4
      },
      "raw_claim_weight": 23,
      "normalized_claim_weight": 32.9,
      "claim_score": 8,
      "semantic_status": "strong",
      "weighted_claim_score": 26.32,
      "evaluator_note": "Implemented bindings were independently found to validate."
    },
    {
      "claim_id": "CLM-V13-002",
      "source_id": "SRC-V1.3-RESULT",
      "exact_quote": "Load `GLOSSARY.md` before interpreting any term, schema, ADR, or skill.",
      "normalized_claim": "The human glossary is an authority that must precede interpretation of other package surfaces.",
      "claim_type": "rule",
      "dependency_on_other_claims": [],
      "evidence_refs": [
        "EVD-V13-002"
      ],
      "weight_dimensions": {
        "goal_impact": 5,
        "decision_leverage": 4,
        "dependency_centrality": 4,
        "scope_breadth": 5,
        "verification_burden": 4
      },
      "raw_claim_weight": 22,
      "normalized_claim_weight": 31.4,
      "claim_score": 8,
      "semantic_status": "strong",
      "weighted_claim_score": 25.12,
      "evaluator_note": "Semantic synchronization was materially stronger than later releases."
    },
    {
      "claim_id": "CLM-V13-003",
      "source_id": "SRC-V1.3-RESULT",
      "exact_quote": "Package only after schema validation, metadata coverage, manifest coverage, ADR prefix validation, term identity validation, TTL parse validation, and three reflection QA checks pass.",
      "normalized_claim": "Release packaging is conditioned on schema, metadata, inventory, identity, semantic export, and Reflection checks.",
      "claim_type": "verdict_logic",
      "dependency_on_other_claims": [
        "CLM-V13-001",
        "CLM-V13-002"
      ],
      "evidence_refs": [
        "EVD-V13-003"
      ],
      "weight_dimensions": {
        "goal_impact": 5,
        "decision_leverage": 5,
        "dependency_centrality": 5,
        "scope_breadth": 5,
        "verification_burden": 5
      },
      "raw_claim_weight": 25,
      "normalized_claim_weight": 35.7,
      "claim_score": 7,
      "semantic_status": "acceptable",
      "weighted_claim_score": 24.99,
      "evaluator_note": "Controls were strong, although some execution and stale-hash defects remained."
    },
    {
      "claim_id": "CLM-V14B-001",
      "source_id": "SRC-V1.4-BUILD-PACKAGE",
      "exact_quote": "Produce `ados-glossary-v1.4.10.zip` as a corrected closure release of v1.4 that preserves the v1.4 concept model while fixing package identity, schema-instance alignment, manifest/project-structure integrity, stale evidence references, validator coverage, and external Reflection Iteration bootstrap proof behavior.",
      "normalized_claim": "The v1.4 closure build must preserve the concept model and fix identity, contracts, inventory, evidence, validation, and proof behavior.",
      "claim_type": "goal",
      "dependency_on_other_claims": [],
      "evidence_refs": [
        "EVD-V14-005"
      ],
      "weight_dimensions": {
        "goal_impact": 5,
        "decision_leverage": 5,
        "dependency_centrality": 5,
        "scope_breadth": 5,
        "verification_burden": 5
      },
      "raw_claim_weight": 25,
      "normalized_claim_weight": 53.2,
      "claim_score": 8,
      "semantic_status": "strong",
      "weighted_claim_score": 42.56,
      "evaluator_note": "The control prompt named the major defect classes."
    },
    {
      "claim_id": "CLM-V14B-002",
      "source_id": "SRC-V1.4-BUILD-PACKAGE",
      "exact_quote": "All schema-index bindings validate.",
      "normalized_claim": "Every declared schema-index binding must validate for release acceptance.",
      "claim_type": "constraint",
      "dependency_on_other_claims": [
        "CLM-V14B-001"
      ],
      "evidence_refs": [
        "EVD-V14-005"
      ],
      "weight_dimensions": {
        "goal_impact": 4,
        "decision_leverage": 5,
        "dependency_centrality": 4,
        "scope_breadth": 4,
        "verification_burden": 5
      },
      "raw_claim_weight": 22,
      "normalized_claim_weight": 46.8,
      "claim_score": 7,
      "semantic_status": "acceptable",
      "weighted_claim_score": 32.76,
      "evaluator_note": "Useful but insufficient without complete binding coverage and schema-strength checks."
    },
    {
      "claim_id": "CLM-V14A-001",
      "source_id": "SRC-V1.4-AGENT",
      "exact_quote": "Ran 6 tests in 0.001s — OK",
      "normalized_claim": "The simple calculator fixture passed six tests.",
      "claim_type": "output",
      "dependency_on_other_claims": [],
      "evidence_refs": [
        "EVD-CALC-001"
      ],
      "weight_dimensions": {
        "goal_impact": 2,
        "decision_leverage": 2,
        "dependency_centrality": 1,
        "scope_breadth": 1,
        "verification_burden": 2
      },
      "raw_claim_weight": 8,
      "normalized_claim_weight": 100.0,
      "claim_score": 8,
      "semantic_status": "strong",
      "weighted_claim_score": 80.0,
      "evaluator_note": "Strong only for the bounded calculator behavior."
    },
    {
      "claim_id": "CLM-V14R-001",
      "source_id": "SRC-V1.4-RESULT",
      "exact_quote": "Introduced v1.4 profile/runtime layout and generated evidence surfaces.",
      "normalized_claim": "v1.4 adds a broader profile/runtime package structure.",
      "claim_type": "output",
      "dependency_on_other_claims": [],
      "evidence_refs": [
        "EVD-V14-001"
      ],
      "weight_dimensions": {
        "goal_impact": 4,
        "decision_leverage": 3,
        "dependency_centrality": 3,
        "scope_breadth": 4,
        "verification_burden": 2
      },
      "raw_claim_weight": 16,
      "normalized_claim_weight": 18.6,
      "claim_score": 8,
      "semantic_status": "strong",
      "weighted_claim_score": 14.88,
      "evaluator_note": "Structural expansion is directly observable."
    },
    {
      "claim_id": "CLM-V14R-002",
      "source_id": "SRC-V1.4-RESULT",
      "exact_quote": "\"verdict\": \"pass\"",
      "normalized_claim": "The v1.4 result claims release PASS.",
      "claim_type": "verdict_logic",
      "dependency_on_other_claims": [
        "CLM-V14R-001"
      ],
      "evidence_refs": [
        "EVD-V14-002"
      ],
      "weight_dimensions": {
        "goal_impact": 5,
        "decision_leverage": 5,
        "dependency_centrality": 5,
        "scope_breadth": 5,
        "verification_burden": 5
      },
      "raw_claim_weight": 25,
      "normalized_claim_weight": 29.1,
      "claim_score": 2,
      "semantic_status": "broken",
      "weighted_claim_score": 5.82,
      "evaluator_note": "Mutation sensitivity contradicted the confidence implied by PASS."
    },
    {
      "claim_id": "CLM-V14R-003",
      "source_id": "SRC-V1.4-RESULT",
      "exact_quote": "The work plan must be file-grounded and use apply/verify semantics for atomic work.",
      "normalized_claim": "The delivered work plan is required to be grounded to files with Apply/Verify semantics.",
      "claim_type": "constraint",
      "dependency_on_other_claims": [],
      "evidence_refs": [
        "EVD-V14-003"
      ],
      "weight_dimensions": {
        "goal_impact": 5,
        "decision_leverage": 4,
        "dependency_centrality": 5,
        "scope_breadth": 4,
        "verification_burden": 5
      },
      "raw_claim_weight": 23,
      "normalized_claim_weight": 26.7,
      "claim_score": 2,
      "semantic_status": "broken",
      "weighted_claim_score": 5.34,
      "evaluator_note": "The delivered work records did not satisfy the intended grounding."
    },
    {
      "claim_id": "CLM-V14R-004",
      "source_id": "SRC-V1.4-RESULT",
      "exact_quote": "The package defines a glossary/profile model with taxonomy and ontology exports.",
      "normalized_claim": "The result claims synchronized terminology and semantic export surfaces.",
      "claim_type": "output",
      "dependency_on_other_claims": [],
      "evidence_refs": [
        "EVD-V14-004"
      ],
      "weight_dimensions": {
        "goal_impact": 5,
        "decision_leverage": 4,
        "dependency_centrality": 4,
        "scope_breadth": 5,
        "verification_burden": 4
      },
      "raw_claim_weight": 22,
      "normalized_claim_weight": 25.6,
      "claim_score": 3,
      "semantic_status": "weak",
      "weighted_claim_score": 7.68,
      "evaluator_note": "New terms were not fully propagated."
    },
    {
      "claim_id": "CLM-V15B-001",
      "source_id": "SRC-V1.5-BUILD-PACKAGE",
      "exact_quote": "Upgrade ADOS Glossary v1.4.10 to v1.5 so that one delivered package serves both purposes at strict release quality.",
      "normalized_claim": "v1.5 must deliver both profile and replayable runtime purposes at strict release quality.",
      "claim_type": "goal",
      "dependency_on_other_claims": [],
      "evidence_refs": [
        "EVD-V15B-001"
      ],
      "weight_dimensions": {
        "goal_impact": 5,
        "decision_leverage": 5,
        "dependency_centrality": 5,
        "scope_breadth": 5,
        "verification_burden": 5
      },
      "raw_claim_weight": 25,
      "normalized_claim_weight": 33.3,
      "claim_score": 9,